{
  "changed": true,
  "intent": "social",
  "summary": "和菌丝复合屋的腐工蕈交流，了解基地状况",
  "user_text": "问问腐工蕈们今天基地情况怎么样",
  "location_before": "loc:l01-creek",
  "location_after": "loc:l01-creek",
  "game_time_before": "第28天 · 上午",
  "game_time_after": "第28天 · 上午",
  "expected_turn_id": "turn:000038",
  "events": [
    {
      "type": "social",
      "source": "social_interaction",
      "title": "社交：询问腐工蕈",
      "summary": "在小溪边和随行的腐工蕈交流，询问基地各处运行状态。",
      "payload": {
        "interaction_type": "inquiry",
        "target_id": "unit:rot-worker-01",
        "target_type": "unit",
        "location_id": "loc:l01-creek",
        "needs_gm_resolution": true
      }
    }
  ],
  "meta": {
    "current_location_id": "loc:l01-creek",
    "current_time_block": "第28天 · 上午"
  }
}
