{
  "changed": true,
  "intent": "travel",
  "summary": "Travel to L1 creek to check water status.",
  "user_text": "去L1小溪看看",
  "location_before": "loc:home-mycelium-house",
  "location_after": "loc:l01-creek",
  "game_time_before": "第28天 · 清晨",
  "game_time_after": "第28天 · 上午",
  "expected_turn_id": "turn:000037",
  "events": [
    {
      "type": "travel",
      "source": "travel_preview",
      "title": "旅行：前往L1小溪",
      "summary": "从菌丝复合屋下到空地，走到L1小溪边查看水源状态。",
      "payload": {
        "from_location_id": "loc:home-mycelium-house",
        "to_location_id": "loc:l01-creek",
        "estimated_minutes": 10,
        "pace": "normal",
        "needs_gm_resolution": true
      }
    }
  ],
  "meta": {
    "current_location_id": "loc:l01-creek",
    "current_time_block": "第28天 · 上午"
  }
}
